{
  "schemaVersion": "1.0",
  "contractType": "SOLVER_RESULT",
  "requestId": "11111111-1111-4111-8111-111111111111",
  "planVersionId": "22222222-2222-4222-8222-222222222222",
  "generatedAt": "2026-09-15T00:00:02.000Z",
  "definitionRevision": 7,
  "executionRevision": 3,
  "inputHash": "4ce6e395cf7724ba319cb609f9900c8ebca8c71f8aa8ee97fd720a8043e7d0b6",
  "modelVersion": "aps-cpsat-v1",
  "solverVersion": "ortools-9.15",
  "planStatus": "FEASIBLE",
  "solverStatus": "FEASIBLE",
  "resultKind": "FEASIBLE",
  "solverSummary": {
    "stopReason": "COMPLETED",
    "wallTimeMillis": 120,
    "firstSolutionMillis": 40,
    "objectiveValue": 0,
    "bestBound": 0,
    "absoluteGap": 0,
    "relativeGap": 0,
    "variableCount": 12,
    "constraintCount": 8,
    "searchThreads": 1,
    "randomSeed": 1,
    "objectives": [
      {
        "level": "L0",
        "name": "HARD_CONSTRAINT_FEASIBILITY",
        "value": 0,
        "bestBound": 0,
        "provenOptimal": false
      }
    ]
  },
  "candidateHash": "15212053fb85d13120b2ac44e7e0099c5b4e0a5d26b963443de77afcd8227711",
  "candidate": {
    "horizonStartAt": "2026-09-15T00:00:00.000Z",
    "horizonEndAt": "2026-09-17T00:00:00.000Z",
    "jobs": [
      {
        "jobId": "12121212-1212-4212-8212-121212121212",
        "jobType": "NORMAL",
        "operationSpecId": "99999999-9999-4999-8999-999999999999",
        "workCenterId": "55555555-5555-4555-8555-555555555555",
        "plannedQuantity": "10",
        "uomCode": "PCS",
        "startAt": "2026-09-15T01:00:00.000Z",
        "endAt": "2026-09-15T01:10:00.000Z",
        "memberTaskIds": ["77777777-7777-4777-8777-777777777777"],
        "carryRunId": null
      }
    ],
    "segments": [
      {
        "segmentId": "13131313-1313-4313-8313-131313131313",
        "jobId": "12121212-1212-4212-8212-121212121212",
        "phaseId": "aaaaaaaa-aaaa-4aaa-8aaa-aaaaaaaaaaaa",
        "phaseType": "RUN",
        "segmentNo": 1,
        "startAt": "2026-09-15T01:00:00.000Z",
        "endAt": "2026-09-15T01:10:00.000Z",
        "plannedQuantity": "10",
        "releaseAt": "2026-09-15T01:10:00.000Z",
        "releaseQuantity": "10"
      }
    ],
    "allocations": [
      {
        "allocationId": "14141414-1414-4414-8414-141414141414",
        "segmentId": "13131313-1313-4313-8313-131313131313",
        "requirementId": "bbbbbbbb-bbbb-4bbb-8bbb-bbbbbbbbbbbb",
        "resourceId": "44444444-4444-4444-8444-444444444444",
        "resourceType": "PERSON",
        "seatNo": 1,
        "capacityUsed": "1"
      }
    ],
    "futureCarryForwardTaskIds": [],
    "unplannedTaskIds": []
  },
  "problems": []
}
